fiesta,fiestaLabel,locationLabel
http://www.wikidata.org/entity/Q21003744,Volatín de Tudela,Tudela
http://www.wikidata.org/entity/Q21480645,Fiesta del Vítor,Mayorga
http://www.wikidata.org/entity/Q21980996,Las Mondas,Talavera de la Reina
http://www.wikidata.org/entity/Q23199379,Auto Sacramental de los Reyes Magos,Santillana del Mar
http://www.wikidata.org/entity/Q23199388,Entroido de Verín,Verín
http://www.wikidata.org/entity/Q23199390,Moros y Cristianos de Bocairente,Bocairente
http://www.wikidata.org/entity/Q23199619,Semana Santa en Puente Genil,Puente Genil
http://www.wikidata.org/entity/Q23199623,Semana Santa en Arcos de la Frontera,Arcos de la Frontera
http://www.wikidata.org/entity/Q23199627,Semana Santa en Huércal-Overa,Huércal-Overa
http://www.wikidata.org/entity/Q23199628,Semana Santa en Riogordo,Riogordo
http://www.wikidata.org/entity/Q23199632,Semana Santa en Baena,Baena
http://www.wikidata.org/entity/Q23199634,Semana Santa en Castro del Río,Castro del Río
http://www.wikidata.org/entity/Q23199635,Semana Santa en Álora,Álora
http://www.wikidata.org/entity/Q23309268,Semana Santa en Calahorra,Calahorra
http://www.wikidata.org/entity/Q23309290,Semana Santa en Logroño,Logroño
http://www.wikidata.org/entity/Q23309296,Fiestas del Santo,Santo Domingo de la Calzada
http://www.wikidata.org/entity/Q23309463,Día de la Almadía,Burgui
http://www.wikidata.org/entity/Q23309493,Fiestas de Estella,Estella-Lizarra
http://www.wikidata.org/entity/Q23309739,Semana Santa en Ponferrada,Ponferrada
http://www.wikidata.org/entity/Q23309748,Corpus Christi en Béjar,Béjar
http://www.wikidata.org/entity/Q23309754,Fiestas de Nuestra Señora de la Asunción,La Alberca
http://www.wikidata.org/entity/Q23309758,Encierros de Medina del Campo,Medina del Campo
http://www.wikidata.org/entity/Q23452661,Pasión Viviente de Chinchón,Chinchón
http://www.wikidata.org/entity/Q23452764,Fiestas del Cristo de los Remedios,San Sebastián de los Reyes
http://www.wikidata.org/entity/Q23452890,Romería de la Virgen de Gracia,San Lorenzo de El Escorial
http://www.wikidata.org/entity/Q23540583,Fiestas Aracelinatas,Lucena
http://www.wikidata.org/entity/Q23541308,Semana Santa en Teruel,Teruel
http://www.wikidata.org/entity/Q23541310,Día del Traje Típico Ansotano,Ansó
http://www.wikidata.org/entity/Q23541312,Fiestas del Santo Cristo y San Vicente Ferrer,Graus
http://www.wikidata.org/entity/Q23615758,Fiestas Patronales en Honor de la Virgen de Ermitana,Peñíscola
http://www.wikidata.org/entity/Q23640572,Fiestas mayores de Almansa,Almansa
http://www.wikidata.org/entity/Q23640575,Semana de la Zarzuela,La Solana
http://www.wikidata.org/entity/Q23648119,Fallas de Sagunto,Sagunto
http://www.wikidata.org/entity/Q23648123,El Cerezo en Flor,Valle del Jerte
http://www.wikidata.org/entity/Q23648126,La Bajada del Ángel,Peñafiel
http://www.wikidata.org/entity/Q23648134,Semana Santa en Sagunto,Sagunto
http://www.wikidata.org/entity/Q23650029,Semana Santa en Mula,Mula
http://www.wikidata.org/entity/Q23650033,Semana Santa en Badajoz,Badajoz
http://www.wikidata.org/entity/Q23650034,Semana Santa en Jerez de los Caballeros,Jerez de los Caballeros
http://www.wikidata.org/entity/Q23650037,Moros y Cristianos de Bañeres,Bañeres
http://www.wikidata.org/entity/Q23650256,Romería de Nuestra Señora de la Cabeza,Andújar
http://www.wikidata.org/entity/Q23650260,Fiestas de las Cruces y los Fuegos de Mayo,
http://www.wikidata.org/entity/Q23650264,Corpus Christi en Villa de Mazo,Villa de Mazo
http://www.wikidata.org/entity/Q23650267,Octava del Corpus y Romería de San Isidro,La Orotava
http://www.wikidata.org/entity/Q23650270,Ajedrez Viviente,Jávea
http://www.wikidata.org/entity/Q23650273,Moros y Cristianos de Onteniente,Ontinyent
http://www.wikidata.org/entity/Q23650275,Fiestas de Segorbe,Segorbe
http://www.wikidata.org/entity/Q23650276,Feria de Murcia,Murcia
http://www.wikidata.org/entity/Q23650278,Romería de Nuestra Señora de la Barca,Muxía
http://www.wikidata.org/entity/Q23650279,Fiestas de Nuestra Señora del Rosario,
http://www.wikidata.org/entity/Q23650280,Moros y Cristianos de Crevillente,Crevillente
http://www.wikidata.org/entity/Q23650385,Fiesta del Marisco,El Grove
http://www.wikidata.org/entity/Q23653026,Fallas de Gandía,Gandía
http://www.wikidata.org/entity/Q23653034,Moros y Cristianos de Concentaina,Cocentaina
http://www.wikidata.org/entity/Q23653037,Moros y Cristianos de Ollería,Ollería
http://www.wikidata.org/entity/Q23653039,Fiesta del arroz,Sueca
http://www.wikidata.org/entity/Q23653040,Moros y Cristianos de Callosa de Ensarriá,Callosa de Ensarriá
http://www.wikidata.org/entity/Q23653344,Carnaval de Santoña,Santoña
http://www.wikidata.org/entity/Q23653347,La Folía,San Vicente de la Barquera
http://www.wikidata.org/entity/Q23653349,Gala Floral de Torrelavega,Torrelavega
http://www.wikidata.org/entity/Q26846554,Concurso Internacional de Paella Valenciana de Sueca,
http://www.wikidata.org/entity/Q129226,Feria del Caballo,Jerez de la Frontera
http://www.wikidata.org/entity/Q815872,Carnaval de Santa Cruz de Tenerife,Santa Cruz de Tenerife
http://www.wikidata.org/entity/Q827695,Tomatina,Buñol
http://www.wikidata.org/entity/Q829919,Sanfermines,
http://www.wikidata.org/entity/Q1236370,Hogueras de Alicante,Alicante
http://www.wikidata.org/entity/Q1324590,Romería de El Rocío,Almonte
http://www.wikidata.org/entity/Q1469338,Semana Santa en Sevilla,Sevilla
http://www.wikidata.org/entity/Q2115110,Misterio de Elche,Elche
http://www.wikidata.org/entity/Q2356144,Rapa das bestas,Galicia
http://www.wikidata.org/entity/Q2886090,Entierro de la Sardina en Murcia,Murcia
http://www.wikidata.org/entity/Q2918983,Feria de Abril,Sevilla
http://www.wikidata.org/entity/Q2939698,Carnaval de Cádiz,Cádiz
http://www.wikidata.org/entity/Q3001481,Carreras de caballos de Sanlúcar,Sanlúcar de Barrameda
http://www.wikidata.org/entity/Q3065313,Semana Santa en Vivero,Vivero
http://www.wikidata.org/entity/Q3092923,Carthagineses y Romanos,Cartagena
http://www.wikidata.org/entity/Q3327994,Procesión del Domingo de Ramos de Elche,Elche
http://www.wikidata.org/entity/Q3328419,Festival de Ortigueira,Ortigueira
http://www.wikidata.org/entity/Q3397662,Entrada de toros y caballos,Segorbe
http://www.wikidata.org/entity/Q3444111,Ruta del Tambor y el Bombo,Andorra (Teruel)
http://www.wikidata.org/entity/Q3444111,Ruta del Tambor y el Bombo,Alcañiz
http://www.wikidata.org/entity/Q3444111,Ruta del Tambor y el Bombo,Urrea de Gaén
http://www.wikidata.org/entity/Q3444111,Ruta del Tambor y el Bombo,Calanda
http://www.wikidata.org/entity/Q3444111,Ruta del Tambor y el Bombo,Albalate del Arzobispo
http://www.wikidata.org/entity/Q3444111,Ruta del Tambor y el Bombo,Alcorisa
http://www.wikidata.org/entity/Q3444111,Ruta del Tambor y el Bombo,Samper de Calanda
http://www.wikidata.org/entity/Q3444111,Ruta del Tambor y el Bombo,La Puebla de Híjar
http://www.wikidata.org/entity/Q3478355,Semana Santa en Palencia,Palencia
http://www.wikidata.org/entity/Q5048232,Cascamorras,Guadix
http://www.wikidata.org/entity/Q5048232,Cascamorras,Baza
http://www.wikidata.org/entity/Q5429969,Feria de Albacete,Albacete
http://www.wikidata.org/entity/Q5650710,Moros y Cristianos de Alcoy,Alcoy
http://www.wikidata.org/entity/Q5685566,Semana Santa en Murcia,Murcia
http://www.wikidata.org/entity/Q5719012,Bando de la Huerta,Murcia
http://www.wikidata.org/entity/Q5752929,Carnaval de Águilas,Águilas
http://www.wikidata.org/entity/Q5763483,Certamen Internacional de Habaneras y Polifonía de Torrevieja,Torrevieja
http://www.wikidata.org/entity/Q5861338,Festival del Cante de las Minas,La Unión
http://www.wikidata.org/entity/Q5861717,Fiesta de la Vendimia (Jerez de la Frontera),Jerez de la Frontera
http://www.wikidata.org/entity/Q5886937,Semana Santa en Zamora,Zamora
http://www.wikidata.org/entity/Q5962041,La Arribada,Bayona
http://www.wikidata.org/entity/Q6087155,Procesión del Corpus Christi de Toledo,Toledo
http://www.wikidata.org/entity/Q6124513,Semana Santa en Cuenca,Cuenca
http://www.wikidata.org/entity/Q6124517,Semana Santa en Cáceres,Cáceres
http://www.wikidata.org/entity/Q6124527,Semana Santa en Hellín,Hellín
http://www.wikidata.org/entity/Q6124557,Semana Santa en Medina de Rioseco,Medina de Rioseco
http://www.wikidata.org/entity/Q6124559,Semana Santa en Medina del Campo,Medina del Campo
http://www.wikidata.org/entity/Q6124571,Semana Santa en Orihuela,Orihuela
http://www.wikidata.org/entity/Q6124609,Semana Santa en Ávila,Ávila
http://www.wikidata.org/entity/Q7884112,Semana Santa en Cartagena,Cartagena
http://www.wikidata.org/entity/Q8355038,Descenso Internacional del Sella,Arriondas
http://www.wikidata.org/entity/Q8961628,Fiestas de la Magdalena (Castellón de la Plana),Castellón de la Plana
http://www.wikidata.org/entity/Q9075872,Semana Santa Ferrolana,Ferrol
http://www.wikidata.org/entity/Q9075873,Semana Santa en Granada,Granada
http://www.wikidata.org/entity/Q9075874,Semana Santa en León,León
http://www.wikidata.org/entity/Q9075878,Semana Santa en Lorca,Lorca
http://www.wikidata.org/entity/Q9075880,Semana Santa en Salamanca,Salamanca
http://www.wikidata.org/entity/Q9075883,Semana Santa en Málaga,Málaga
http://www.wikidata.org/entity/Q9075883,Semana Santa en Málaga,provincia de Málaga
http://www.wikidata.org/entity/Q9075887,Semana Santa en Valladolid,Valladolid
http://www.wikidata.org/entity/Q9075892,Semana Santa en Zaragoza,Zaragoza
http://www.wikidata.org/entity/Q12388488,Fiesta de Santiago Apóstol,Santiago de Compostela
http://www.wikidata.org/entity/Q16609048,Moros y Cristianos de Villajoyosa,Villajoyosa
http://www.wikidata.org/entity/Q23046683,Semana Santa en Crevillente,Crevillente
http://www.wikidata.org/entity/Q23047569,Romería Vikinga de Catoira,Catoira
http://www.wikidata.org/entity/Q23199311,Semana Santa en Toledo,Toledo
http://www.wikidata.org/entity/Q23199332,Hogueras de San Juan,La Coruña
http://www.wikidata.org/entity/Q23199370,Motín de Aranjuez,Aranjuez
http://www.wikidata.org/entity/Q25511382,Corpus Christi en Puenteareas,Puenteareas
http://www.wikidata.org/entity/Q1143768,Fallas de Valencia,Valencia
http://www.wikidata.org/entity/Q1236370,Hogueras de Alicante,Alicante
http://www.wikidata.org/entity/Q2176621,Q2176621,
http://www.wikidata.org/entity/Q3092925,Fiestas del Pilar,Zaragoza
http://www.wikidata.org/entity/Q5861807,Fiestas de Fuenlabrada,
http://www.wikidata.org/entity/Q8961595,Fiesta Mayor de Reus,Reus
http://www.wikidata.org/entity/Q11921891,Festa Major de Badalona,
http://www.wikidata.org/entity/Q11921892,Fiestas de Gracia,Villa de Gracia
http://www.wikidata.org/entity/Q11921893,Festa Major de Sant Joan Baptista de Valls,
http://www.wikidata.org/entity/Q11921926,Fiesta Mayor de San Luis,San Luis
http://www.wikidata.org/entity/Q11921927,Fiestas del Tura,Olot
http://www.wikidata.org/entity/Q16303295,"Fiestas de la Virgen, Yecla",Yecla
http://www.wikidata.org/entity/Q17301586,Fiesta Mayor de Castelltersol,Castelltersol
http://www.wikidata.org/entity/Q18696203,Fiesta Mayor de Villafranca del Panadés,Villafranca del Panadés
http://www.wikidata.org/entity/Q19917524,Festa Major del Clot,
http://www.wikidata.org/entity/Q20102845,Festa Major de Can Peguera,
http://www.wikidata.org/entity/Q20102966,Festa Major de la Prosperitat,
http://www.wikidata.org/entity/Q20103063,Festa Major de la Rambla,
http://www.wikidata.org/entity/Q20103076,Festes del Raval,
http://www.wikidata.org/entity/Q20104225,Festa Major d'Agost de Badalona,
http://www.wikidata.org/entity/Q20104229,Festa Major de la Dreta de l'Eixample,
http://www.wikidata.org/entity/Q20104233,Festa Major de la Salut,
http://www.wikidata.org/entity/Q20104238,"Festa Major de la Teixonera, Mas Falcó i Penitents",
http://www.wikidata.org/entity/Q20104248,Festa Major de Sant Antoni,
http://www.wikidata.org/entity/Q20104252,Festa Major del Besòs i del Maresme,
http://www.wikidata.org/entity/Q20104262,Festa Major del Fort Pienc,
http://www.wikidata.org/entity/Q20104265,Festa Major del Pi,
http://www.wikidata.org/entity/Q20104434,Festa Major del Carmel,
http://www.wikidata.org/entity/Q20104445,Festa Major del Poblenou,
http://www.wikidata.org/entity/Q20104469,Festa Major de la Font d'en Fargues,
http://www.wikidata.org/entity/Q20104482,Festa Major del Turó de la Peira,
http://www.wikidata.org/entity/Q20104506,Festa Major de Porta,
http://www.wikidata.org/entity/Q20104613,Festa Major de la Vall d'Hebron,
http://www.wikidata.org/entity/Q20104655,Festa Major del Casc Antic,
http://www.wikidata.org/entity/Q20104667,Festa Major de Verdum,
http://www.wikidata.org/entity/Q20104876,Fiesta Mayor de Granollers,
http://www.wikidata.org/entity/Q20104915,Festa Major de Ciutat Meridiana,
http://www.wikidata.org/entity/Q20104956,Festa Major de la Clota,
http://www.wikidata.org/entity/Q20104964,Festa Major del Guinardó,
http://www.wikidata.org/entity/Q20105027,Festa Major d'Horta,
http://www.wikidata.org/entity/Q20105877,Festa Major del Baix Guinardó,
http://www.wikidata.org/entity/Q20105975,Festa Major de la Barceloneta,
http://www.wikidata.org/entity/Q20106073,Festa Major de la Mare de Déu de la Riera de les Borges del Camp,Borjas del Campo
http://www.wikidata.org/entity/Q20106203,Festa Major de Montbau,
http://www.wikidata.org/entity/Q20106415,Festa Major de l'Esquerra de l'Eixample,
http://www.wikidata.org/entity/Q20106420,Festa Major de la Verneda i Sant Martí,
http://www.wikidata.org/entity/Q20106424,Festa Major de Nou Barris,
http://www.wikidata.org/entity/Q20106425,Festa Major de les Corts,
http://www.wikidata.org/entity/Q20106433,Festa Major del Camp d'en Grassot i de Gràcia Nova,
http://www.wikidata.org/entity/Q20106436,Festa Major del Coll,
http://www.wikidata.org/entity/Q20106450,Festes Majors d'Hivern de Sant Blai de la Fatarella,
http://www.wikidata.org/entity/Q20106481,Festa Major de Torre Baró,
http://www.wikidata.org/entity/Q20106650,Festa Major de la Trinitat Nova,
http://www.wikidata.org/entity/Q20106670,Festa Major de les Roquetes,
http://www.wikidata.org/entity/Q20106755,Festa Major de la Guineueta,
http://www.wikidata.org/entity/Q20106794,Festa Major de Sant Genís dels Agudells,
http://www.wikidata.org/entity/Q20107331,Festa Major de la Bordeta,
http://www.wikidata.org/entity/Q20107766,Festa Major de Can Baró,
http://www.wikidata.org/entity/Q20107785,Festa Major de Canyelles,
http://www.wikidata.org/entity/Q20108096,Festa Major de la Sagrada Família,
http://www.wikidata.org/entity/Q20108097,Festa Major de la Vila Olímpica,
http://www.wikidata.org/entity/Q20108098,Fiesta Mayor de las Nieves de Villanueva y Geltrú,Villanueva y Geltrú
http://www.wikidata.org/entity/Q20108299,Fiesta Mayor de Arbós,Arbós
http://www.wikidata.org/entity/Q20108749,Festa Major del Putget,
http://www.wikidata.org/entity/Q20109092,Festa Major de Vallbona,
http://www.wikidata.org/entity/Q20109116,Festa Major de Vilapicina i Torre Llobeta,
http://www.wikidata.org/entity/Q23199370,Motín de Aranjuez,Aranjuez
http://www.wikidata.org/entity/Q23309296,Fiestas del Santo,Santo Domingo de la Calzada
http://www.wikidata.org/entity/Q23309493,Fiestas de Estella,Estella-Lizarra
http://www.wikidata.org/entity/Q23309754,Fiestas de Nuestra Señora de la Asunción,La Alberca
http://www.wikidata.org/entity/Q23310065,Fiesta de las Candelas,Cea
http://www.wikidata.org/entity/Q23449316,Romería de la Virgen de las Angustias,La Milla del Río
http://www.wikidata.org/entity/Q23449563,Romería de San Froilán,Valdorria
http://www.wikidata.org/entity/Q23452764,Fiestas del Cristo de los Remedios,San Sebastián de los Reyes
http://www.wikidata.org/entity/Q23455600,Fiesta de San Sebastián,Villaviciosa de Odón
http://www.wikidata.org/entity/Q23459290,Fiestas de Nuestra Señora de los Santos y San Simón de Rojas,Móstoles
http://www.wikidata.org/entity/Q23459345,Embarcación de la Virgen de la Alarilla,Fuentidueña de Tajo
http://www.wikidata.org/entity/Q23500667,festa de Sant Nicasi,
http://www.wikidata.org/entity/Q23540271,Fiestas de San Sebastián,Lubrín
http://www.wikidata.org/entity/Q23540407,Fiestas de San Sebastián,Olula del Río
http://www.wikidata.org/entity/Q23540583,Fiestas Aracelinatas,Lucena
http://www.wikidata.org/entity/Q23540764,Fiesta de San Isidro Labrador,Estepona
http://www.wikidata.org/entity/Q23541026,Fiesta en Honor a Nuestra Señora del Rosario ,Carrión de los Céspedes
http://www.wikidata.org/entity/Q23541279,Fiestas de Nuestra Señora de Regla,Chipiona
http://www.wikidata.org/entity/Q23541312,Fiestas del Santo Cristo y San Vicente Ferrer,Graus
http://www.wikidata.org/entity/Q23640572,Fiestas mayores de Almansa,Almansa
http://www.wikidata.org/entity/Q23641859,Fiesta de San Antonio,Matarraña
http://www.wikidata.org/entity/Q23641876,Fiestas de San Sebastián,Castelserás
http://www.wikidata.org/entity/Q23641877,Fiesta de los Sanantones y la Encamisada,Estercuel
http://www.wikidata.org/entity/Q23641879,Fiestas de San Blas,Ateca
http://www.wikidata.org/entity/Q23647866,Fiestas de San Juan Evangelista y Santa Quiteria,Huete
http://www.wikidata.org/entity/Q23650275,Fiestas de Segorbe,Segorbe
http://www.wikidata.org/entity/Q23650279,Fiestas de Nuestra Señora del Rosario,
http://www.wikidata.org/entity/Q648409,La Vijanera,Silió
http://www.wikidata.org/entity/Q895266,Bous a la Mar,Denia
http://www.wikidata.org/entity/Q2054423,Carnaval de La Bañeza,La Bañeza
http://www.wikidata.org/entity/Q2834310,Fallas de Alcira,Alcira
http://www.wikidata.org/entity/Q2890938,Batalla del vino,Haro
http://www.wikidata.org/entity/Q3092925,Fiestas del Pilar,Zaragoza
http://www.wikidata.org/entity/Q3181317,Fiestas de la Merced,Barcelona
http://www.wikidata.org/entity/Q3395702,Fiesta del albariño,Cambados
http://www.wikidata.org/entity/Q4121017,Festival de los Patios Cordobeses,Córdoba
http://www.wikidata.org/entity/Q4163493,La Pasión de Callosa de Segura,Callosa de Segura
http://www.wikidata.org/entity/Q4848804,Fiestas Lustrales de la Bajada de la Virgen de las Nieves,Santa Cruz de La Palma
http://www.wikidata.org/entity/Q4895460,Fiestas de Santa Tecla,Tarragona
http://www.wikidata.org/entity/Q4896555,El Jarramplas,Piornal
http://www.wikidata.org/entity/Q5121286,Cipotegato,Tarazona
http://www.wikidata.org/entity/Q5400462,Carreritas,
http://www.wikidata.org/entity/Q5552003,Semana Santa en Jumilla,Jumilla
http://www.wikidata.org/entity/Q5660198,Fiestas de San Bernabé,Logroño
http://www.wikidata.org/entity/Q5667441,Semana Santa en Utrera,Utrera
http://www.wikidata.org/entity/Q5691435,Semana Santa en Ciudad Real,Ciudad Real
http://www.wikidata.org/entity/Q5722479,Batalla de Flores,Laredo
http://www.wikidata.org/entity/Q5737798,Caballada de Atienza,Atienza
http://www.wikidata.org/entity/Q5752821,Carnaval de Badajoz,Badajoz
http://www.wikidata.org/entity/Q5752915,Carnaval de Villarrobledo,Villarrobledo
http://www.wikidata.org/entity/Q5752931,Carnaval del Toro,Ciudad Rodrigo
http://www.wikidata.org/entity/Q5789983,Coso Blanco,Castro Urdiales
http://www.wikidata.org/entity/Q5803879,Descenso a nado de la ría del Navia,Navia
http://www.wikidata.org/entity/Q5815728,Día de América en Asturias,Oviedo
http://www.wikidata.org/entity/Q5815733,Día de Cantabria,Cabezón de la Sal
http://www.wikidata.org/entity/Q5820985,Bautizo del Niño,Palencia
http://www.wikidata.org/entity/Q5832389,Encierros de Cuéllar,Cuéllar
http://www.wikidata.org/entity/Q5860920,Festival Folklórico de los Pirineos,Jaca
http://www.wikidata.org/entity/Q5860920,Festival Folklórico de los Pirineos,Oloron-Sainte-Marie
http://www.wikidata.org/entity/Q5861076,Festival Medieval de Hita,Hita
http://www.wikidata.org/entity/Q5861311,Festival de la Sidra,Nava
http://www.wikidata.org/entity/Q5861673,Fiesta de La Vaquilla,Colmenar Viejo
http://www.wikidata.org/entity/Q5861679,Fiesta de Nuestra Señora del Rosario (Luarca),Luarca
http://www.wikidata.org/entity/Q5861721,Fiesta de la Virgen de la Guía,Llanes
http://www.wikidata.org/entity/Q5861740,Fiesta de las Cuadrillas,Barranda
http://www.wikidata.org/entity/Q5861769,Fiesta del Orujo,Potes
http://www.wikidata.org/entity/Q5861770,Fiesta del Pan y del Queso,Quel
http://www.wikidata.org/entity/Q5861825,Fiestas de San Lorenzo (Huesca),Huesca
http://www.wikidata.org/entity/Q5861827,Fiestas de San Mateo,Logroño
http://www.wikidata.org/entity/Q5861870,Fiestas patronales Sagrada Familia y Santísimo Cristo,Vall de Uxó
http://www.wikidata.org/entity/Q5887906,Guerras Cántabras (fiesta),Los Corrales de Buelna
http://www.wikidata.org/entity/Q5936421,Jornadas medievales de Briones,Briones
http://www.wikidata.org/entity/Q6019517,Misterio de Obanos,Obanos
http://www.wikidata.org/entity/Q6038341,Naseiro,Vivero
http://www.wikidata.org/entity/Q6065752,Pasión Viviente de Castro Urdiales,Castro Urdiales
http://www.wikidata.org/entity/Q6124466,Semana Santa de Jaén,Jaén
http://www.wikidata.org/entity/Q6124473,Semana Santa en Alcira,Alcira
http://www.wikidata.org/entity/Q6124477,Semana Santa en Almería,Almería
http://www.wikidata.org/entity/Q6124485,Semana Santa en Astorga,Astorga
http://www.wikidata.org/entity/Q6124498,Semana Santa en Burgos,Burgos
http://www.wikidata.org/entity/Q6124500,Semana Santa en Cabra,Cabra
http://www.wikidata.org/entity/Q6124511,Semana Santa en Cieza,Cieza
http://www.wikidata.org/entity/Q6124521,Semana Santa en Estepa,Estepa
http://www.wikidata.org/entity/Q6124531,Semana Santa en Huelva,Huelva
http://www.wikidata.org/entity/Q6124533,Semana Santa en Jerez de la Frontera,Jerez de la Frontera
http://www.wikidata.org/entity/Q6124542,Semana Santa en Linares,Linares
http://www.wikidata.org/entity/Q6124544,Semana Santa en Loja,Loja
http://www.wikidata.org/entity/Q6124551,Semana Santa en Martos,Martos
http://www.wikidata.org/entity/Q6124564,Semana Santa en Mérida,Mérida
http://www.wikidata.org/entity/Q6124566,Semana Santa en Ocaña,Ocaña
http://www.wikidata.org/entity/Q6124569,Semana Santa en Olvera,Olvera
http://www.wikidata.org/entity/Q6124586,Semana Santa en San Fernando (Cádiz),San Fernando
http://www.wikidata.org/entity/Q6124598,Semana Santa en Tobarra,Tobarra
http://www.wikidata.org/entity/Q6124611,Semana Santa en Écija,Écija
http://www.wikidata.org/entity/Q6124613,Semana Santa en Úbeda,Úbeda
http://www.wikidata.org/entity/Q6711801,Aplec del Caragol,Lérida
http://www.wikidata.org/entity/Q7401479,Fiestas de San Juan del Monte,Miranda de Ebro
http://www.wikidata.org/entity/Q8771143,Día de Asturias en Gijón,Gijón
http://www.wikidata.org/entity/Q8961227,Feria de Todos los Santos de Cocentaina,Cocentaina
http://www.wikidata.org/entity/Q8961606,Fiesta del Agua de Villagarcía de Arosa,Villagarcía de Arosa
http://www.wikidata.org/entity/Q8961623,Fiestas de San Vicente Ferrer,Vall de Uxó
http://www.wikidata.org/entity/Q9024118,Los Picaos de San Vicente de la Sonsierra,San Vicente de la Sonsierra
http://www.wikidata.org/entity/Q9035210,Moros y Cristianos de Villena,Villena
http://www.wikidata.org/entity/Q9056620,Paso del Fuego,San Pedro Manrique
http://www.wikidata.org/entity/Q9066149,Rally Internacional Barcelona-Sitges,Sitges
http://www.wikidata.org/entity/Q9075846,Semana Santa Marinera,Poblados Marítimos
http://www.wikidata.org/entity/Q9075862,Semana Santa en Baeza,Baeza
http://www.wikidata.org/entity/Q9075868,Semana Santa en Córdoba,Córdoba
http://www.wikidata.org/entity/Q9076605,Sexenio de Morella,
http://www.wikidata.org/entity/Q11166489,Cabalgata de Reyes Magos de Alcoy,Alcoy
http://www.wikidata.org/entity/Q11915705,Corpus de Sitget,Sitges
http://www.wikidata.org/entity/Q11921918,Fiesta del Renacimiento,Tortosa
http://www.wikidata.org/entity/Q11922101,Feria de Agosto de Játiva,Xátiva
http://www.wikidata.org/entity/Q11947723,Santíssim Misteri de Cervera,Cervera
http://www.wikidata.org/entity/Q11949578,Semana Medieval de San Jorge,Montblanc
http://www.wikidata.org/entity/Q12388467,Fiesta de la Historia,Ribadavia
http://www.wikidata.org/entity/Q12388482,Fiesta del Pulpo de O Carballiño,Carballino
http://www.wikidata.org/entity/Q12388485,Fiestas de San Froilán de Lugo,Lugo
http://www.wikidata.org/entity/Q16303295,"Fiestas de la Virgen, Yecla",Yecla
http://www.wikidata.org/entity/Q17632257,Festival de Exaltación del Botillo,Bembibre
http://www.wikidata.org/entity/Q17632299,Fiestas de Santa Ana,Tudela
http://www.wikidata.org/entity/Q17993325,Alfombras de Serrín de Elche de la Sierra,Elche de la Sierra
http://www.wikidata.org/entity/Q20001242,La Pasión de Esparraguera,Esparraguera
http://www.wikidata.org/entity/Q20014639,Día de la Faldeta,Fraga
http://www.wikidata.org/entity/Q20017036,La Bajada del Ángel,Tudela
http://www.wikidata.org/entity/Q20541714,Entroido de Ginzo de Limia,Ginzo de Limia
http://www.wikidata.org/entity/Q20544324,Fiesta del Cocido,Lalín
http://www.wikidata.org/entity/Q3392407,Arde Lucus,Lugo
http://www.wikidata.org/entity/Q5752861,Carnaval de Laza,Laza
http://www.wikidata.org/entity/Q5799146,Danza de San Sebastián de Aldán,Aldán
http://www.wikidata.org/entity/Q5858753,Feria Franca Medieval,Betanzos
http://www.wikidata.org/entity/Q5861700,Fiesta de la Almeja,Villagarcía de Arosa
http://www.wikidata.org/entity/Q6003103,Maruxaina,San Ciprián
http://www.wikidata.org/entity/Q6038341,Naseiro,Vivero
http://www.wikidata.org/entity/Q8961500,Festa da Dorna,Riveira
http://www.wikidata.org/entity/Q9066621,Rapa das Bestas de Sabucedo,Sabucedo
http://www.wikidata.org/entity/Q12388339,Feria del Bonito,Burela
http://www.wikidata.org/entity/Q12388466,Fiesta de la Virgen de Guadalupe,Rianjo
http://www.wikidata.org/entity/Q12388467,Fiesta de la Historia,Ribadavia
http://www.wikidata.org/entity/Q12388474,Festa do Boi de Allariz,Allariz
http://www.wikidata.org/entity/Q12388477,Fiesta del Carnero al Espeto,Moraña
http://www.wikidata.org/entity/Q12388480,Fiesta de Exaltación del Pan de Cea,San Cristóbal de Cea
http://www.wikidata.org/entity/Q12388481,Fiesta del Pulpo,Mugardos
http://www.wikidata.org/entity/Q12388642,Folión de Carros,Chantada
